{
  "ok": true,
  "artifact_type": "provider-incident-recovery-audit",
  "generated_at": "2026-07-23T16:50:10.566Z",
  "project_root": "/Users/mn/development/ai-organization-framework-public",
  "summary": {
    "recovery_count": 1,
    "ready_count": 1,
    "blocked_count": 0,
    "resume_allowed_count": 0,
    "stop_or_escalate_count": 1,
    "failing_check_count": 0
  },
  "recoveries": [
    {
      "recovery_id": "PIR-TASK-115-V95",
      "release_ref": "docs/v9.5-release-definition.md",
      "work_item_id": "TASK-115",
      "severity": "high",
      "rollback_decision": "rollback_ready",
      "resume_decision": "defer",
      "governance_action": "rollback_then_review",
      "recovery_status": "ready_for_drill",
      "artifact_ref": ".aof/artifacts/provider-incident-recoveries/PIR-TASK-115-V95.json"
    }
  ],
  "checks": [
    {
      "name": "provider incident recovery presence",
      "status": "pass",
      "detail": "1 recovery record(s) found",
      "evidence_refs": [
        ".aof/artifacts/provider-incident-recoveries/PIR-TASK-115-V95.json"
      ]
    },
    {
      "name": "PIR-TASK-115-V95 release ref resolves",
      "status": "pass",
      "detail": "docs/v9.5-release-definition.md",
      "evidence_refs": [
        ".aof/artifacts/provider-incident-recoveries/PIR-TASK-115-V95.json",
        "docs/v9.5-release-definition.md",
        ".aof/tasks/done/TASK-115.json",
        ".aof/artifacts/provider-controlled-execution-candidates/PCEC-TASK-114-V94.json",
        ".aof/artifacts/provider-execution-approvals/PEA-TASK-107-GITHUB-ISSUE-PREFLIGHT.json",
        ".aof/artifacts/provider-execution-reproductions/PERP-TASK-108-GITHUB-ISSUE.json",
        ".aof/artifacts/provider-rollback-proofs/PRB-TASK-108-GITHUB-ISSUE.json",
        ".aof/artifacts/provider-outcome-evidence/POE-TASK-109-GITHUB-ISSUE.json",
        ".aof/artifacts/provider-learning-loop/PLL-TASK-109-GITHUB-ISSUE.json",
        ".aof/artifacts/operator-acceptance-drills/OAD-TASK-110-V90-SELF-HOSTING.json",
        ".aof/artifacts/provider-production-boundaries/PPB-TASK-112-V92.json",
        ".aof/artifacts/provider-learning-loop/PLL-TASK-109-GITHUB-ISSUE.json",
        "docs/v9.5-release-definition.md",
        ".aof/artifacts/provider-controlled-execution-candidates/PCEC-TASK-114-V94.json",
        "test/runtime-core-2.test.js"
      ]
    },
    {
      "name": "PIR-TASK-115-V95 work item ref resolves",
      "status": "pass",
      "detail": ".aof/tasks/done/TASK-115.json",
      "evidence_refs": [
        ".aof/artifacts/provider-incident-recoveries/PIR-TASK-115-V95.json",
        "docs/v9.5-release-definition.md",
        ".aof/tasks/done/TASK-115.json",
        ".aof/artifacts/provider-controlled-execution-candidates/PCEC-TASK-114-V94.json",
        ".aof/artifacts/provider-execution-approvals/PEA-TASK-107-GITHUB-ISSUE-PREFLIGHT.json",
        ".aof/artifacts/provider-execution-reproductions/PERP-TASK-108-GITHUB-ISSUE.json",
        ".aof/artifacts/provider-rollback-proofs/PRB-TASK-108-GITHUB-ISSUE.json",
        ".aof/artifacts/provider-outcome-evidence/POE-TASK-109-GITHUB-ISSUE.json",
        ".aof/artifacts/provider-learning-loop/PLL-TASK-109-GITHUB-ISSUE.json",
        ".aof/artifacts/operator-acceptance-drills/OAD-TASK-110-V90-SELF-HOSTING.json",
        ".aof/artifacts/provider-production-boundaries/PPB-TASK-112-V92.json",
        ".aof/artifacts/provider-learning-loop/PLL-TASK-109-GITHUB-ISSUE.json",
        "docs/v9.5-release-definition.md",
        ".aof/artifacts/provider-controlled-execution-candidates/PCEC-TASK-114-V94.json",
        "test/runtime-core-2.test.js"
      ]
    },
    {
      "name": "PIR-TASK-115-V95 candidate ref resolves",
      "status": "pass",
      "detail": ".aof/artifacts/provider-controlled-execution-candidates/PCEC-TASK-114-V94.json",
      "evidence_refs": [
        ".aof/artifacts/provider-incident-recoveries/PIR-TASK-115-V95.json",
        "docs/v9.5-release-definition.md",
        ".aof/tasks/done/TASK-115.json",
        ".aof/artifacts/provider-controlled-execution-candidates/PCEC-TASK-114-V94.json",
        ".aof/artifacts/provider-execution-approvals/PEA-TASK-107-GITHUB-ISSUE-PREFLIGHT.json",
        ".aof/artifacts/provider-execution-reproductions/PERP-TASK-108-GITHUB-ISSUE.json",
        ".aof/artifacts/provider-rollback-proofs/PRB-TASK-108-GITHUB-ISSUE.json",
        ".aof/artifacts/provider-outcome-evidence/POE-TASK-109-GITHUB-ISSUE.json",
        ".aof/artifacts/provider-learning-loop/PLL-TASK-109-GITHUB-ISSUE.json",
        ".aof/artifacts/operator-acceptance-drills/OAD-TASK-110-V90-SELF-HOSTING.json",
        ".aof/artifacts/provider-production-boundaries/PPB-TASK-112-V92.json",
        ".aof/artifacts/provider-learning-loop/PLL-TASK-109-GITHUB-ISSUE.json",
        "docs/v9.5-release-definition.md",
        ".aof/artifacts/provider-controlled-execution-candidates/PCEC-TASK-114-V94.json",
        "test/runtime-core-2.test.js"
      ]
    },
    {
      "name": "PIR-TASK-115-V95 approval ref resolves",
      "status": "pass",
      "detail": ".aof/artifacts/provider-execution-approvals/PEA-TASK-107-GITHUB-ISSUE-PREFLIGHT.json",
      "evidence_refs": [
        ".aof/artifacts/provider-incident-recoveries/PIR-TASK-115-V95.json",
        "docs/v9.5-release-definition.md",
        ".aof/tasks/done/TASK-115.json",
        ".aof/artifacts/provider-controlled-execution-candidates/PCEC-TASK-114-V94.json",
        ".aof/artifacts/provider-execution-approvals/PEA-TASK-107-GITHUB-ISSUE-PREFLIGHT.json",
        ".aof/artifacts/provider-execution-reproductions/PERP-TASK-108-GITHUB-ISSUE.json",
        ".aof/artifacts/provider-rollback-proofs/PRB-TASK-108-GITHUB-ISSUE.json",
        ".aof/artifacts/provider-outcome-evidence/POE-TASK-109-GITHUB-ISSUE.json",
        ".aof/artifacts/provider-learning-loop/PLL-TASK-109-GITHUB-ISSUE.json",
        ".aof/artifacts/operator-acceptance-drills/OAD-TASK-110-V90-SELF-HOSTING.json",
        ".aof/artifacts/provider-production-boundaries/PPB-TASK-112-V92.json",
        ".aof/artifacts/provider-learning-loop/PLL-TASK-109-GITHUB-ISSUE.json",
        "docs/v9.5-release-definition.md",
        ".aof/artifacts/provider-controlled-execution-candidates/PCEC-TASK-114-V94.json",
        "test/runtime-core-2.test.js"
      ]
    },
    {
      "name": "PIR-TASK-115-V95 reproduction ref resolves",
      "status": "pass",
      "detail": ".aof/artifacts/provider-execution-reproductions/PERP-TASK-108-GITHUB-ISSUE.json",
      "evidence_refs": [
        ".aof/artifacts/provider-incident-recoveries/PIR-TASK-115-V95.json",
        "docs/v9.5-release-definition.md",
        ".aof/tasks/done/TASK-115.json",
        ".aof/artifacts/provider-controlled-execution-candidates/PCEC-TASK-114-V94.json",
        ".aof/artifacts/provider-execution-approvals/PEA-TASK-107-GITHUB-ISSUE-PREFLIGHT.json",
        ".aof/artifacts/provider-execution-reproductions/PERP-TASK-108-GITHUB-ISSUE.json",
        ".aof/artifacts/provider-rollback-proofs/PRB-TASK-108-GITHUB-ISSUE.json",
        ".aof/artifacts/provider-outcome-evidence/POE-TASK-109-GITHUB-ISSUE.json",
        ".aof/artifacts/provider-learning-loop/PLL-TASK-109-GITHUB-ISSUE.json",
        ".aof/artifacts/operator-acceptance-drills/OAD-TASK-110-V90-SELF-HOSTING.json",
        ".aof/artifacts/provider-production-boundaries/PPB-TASK-112-V92.json",
        ".aof/artifacts/provider-learning-loop/PLL-TASK-109-GITHUB-ISSUE.json",
        "docs/v9.5-release-definition.md",
        ".aof/artifacts/provider-controlled-execution-candidates/PCEC-TASK-114-V94.json",
        "test/runtime-core-2.test.js"
      ]
    },
    {
      "name": "PIR-TASK-115-V95 rollback ref resolves",
      "status": "pass",
      "detail": ".aof/artifacts/provider-rollback-proofs/PRB-TASK-108-GITHUB-ISSUE.json",
      "evidence_refs": [
        ".aof/artifacts/provider-incident-recoveries/PIR-TASK-115-V95.json",
        "docs/v9.5-release-definition.md",
        ".aof/tasks/done/TASK-115.json",
        ".aof/artifacts/provider-controlled-execution-candidates/PCEC-TASK-114-V94.json",
        ".aof/artifacts/provider-execution-approvals/PEA-TASK-107-GITHUB-ISSUE-PREFLIGHT.json",
        ".aof/artifacts/provider-execution-reproductions/PERP-TASK-108-GITHUB-ISSUE.json",
        ".aof/artifacts/provider-rollback-proofs/PRB-TASK-108-GITHUB-ISSUE.json",
        ".aof/artifacts/provider-outcome-evidence/POE-TASK-109-GITHUB-ISSUE.json",
        ".aof/artifacts/provider-learning-loop/PLL-TASK-109-GITHUB-ISSUE.json",
        ".aof/artifacts/operator-acceptance-drills/OAD-TASK-110-V90-SELF-HOSTING.json",
        ".aof/artifacts/provider-production-boundaries/PPB-TASK-112-V92.json",
        ".aof/artifacts/provider-learning-loop/PLL-TASK-109-GITHUB-ISSUE.json",
        "docs/v9.5-release-definition.md",
        ".aof/artifacts/provider-controlled-execution-candidates/PCEC-TASK-114-V94.json",
        "test/runtime-core-2.test.js"
      ]
    },
    {
      "name": "PIR-TASK-115-V95 outcome ref resolves",
      "status": "pass",
      "detail": ".aof/artifacts/provider-outcome-evidence/POE-TASK-109-GITHUB-ISSUE.json",
      "evidence_refs": [
        ".aof/artifacts/provider-incident-recoveries/PIR-TASK-115-V95.json",
        "docs/v9.5-release-definition.md",
        ".aof/tasks/done/TASK-115.json",
        ".aof/artifacts/provider-controlled-execution-candidates/PCEC-TASK-114-V94.json",
        ".aof/artifacts/provider-execution-approvals/PEA-TASK-107-GITHUB-ISSUE-PREFLIGHT.json",
        ".aof/artifacts/provider-execution-reproductions/PERP-TASK-108-GITHUB-ISSUE.json",
        ".aof/artifacts/provider-rollback-proofs/PRB-TASK-108-GITHUB-ISSUE.json",
        ".aof/artifacts/provider-outcome-evidence/POE-TASK-109-GITHUB-ISSUE.json",
        ".aof/artifacts/provider-learning-loop/PLL-TASK-109-GITHUB-ISSUE.json",
        ".aof/artifacts/operator-acceptance-drills/OAD-TASK-110-V90-SELF-HOSTING.json",